{
  "schema_version": "v1.0",
  "scenario_id": "tea_006_temporal_inversion",
  "artifact_ids": {
    "pass1": "tea_006_temporal_inversion:pass1_answer:11e0abe3578b",
    "pass2": "tea_006_temporal_inversion:pass2_critique:222affa6050d",
    "pass3": "tea_006_temporal_inversion:pass3_repair:86945c49d221"
  },
  "rule_profile_version": "v1_provisional",
  "capability_mode": "external_only",
  "scoring_timestamp": "2026-04-07T16:33:25.403Z",
  "core_final_score": 0.617952380952381,
  "calibration_augmented_score": null,
  "arbiter_pass_status": "AVAILABLE",
  "arbiter_metadata": {
    "arbiter_model_id": "gpt-5.4",
    "arbiter_provider": "openai",
    "official_run_attested": false,
    "certified": false,
    "official_score_eligible": false,
    "certification_label": null
  },
  "leaderboard_status": "unofficial_custom_arbiter",
  "score_components": [
    {
      "component_id": "contradiction_overlap",
      "raw_score": 0.6666666666666666,
      "weight": 0.22,
      "weighted_score": 0.14666666666666667
    },
    {
      "component_id": "gap_closure",
      "raw_score": 0.5,
      "weight": 0.18,
      "weighted_score": 0.09
    },
    {
      "component_id": "premise_rejection",
      "raw_score": 0.9,
      "weight": 0.12,
      "weighted_score": 0.108
    },
    {
      "component_id": "repair_quality",
      "raw_score": 0.6,
      "weight": 0.12,
      "weighted_score": 0.072
    },
    {
      "component_id": "type_discipline",
      "raw_score": 0.65,
      "weight": 0.1,
      "weighted_score": 0.065
    },
    {
      "component_id": "causal_integrity",
      "raw_score": 0.3,
      "weight": 0.1,
      "weighted_score": 0.03
    },
    {
      "component_id": "consistency",
      "raw_score": 0.6666666666666667,
      "weight": 0.08,
      "weighted_score": 0.053333333333333344
    },
    {
      "component_id": "external_calibration",
      "raw_score": 0.6619047619047619,
      "weight": 0.08,
      "weighted_score": 0.05295238095238095
    }
  ],
  "caps_applied": [
    {
      "rule_id": "repair_quality_cap_low_gcr",
      "field": "repair_quality",
      "applied_value": "partial",
      "reason": "Gap closure rate below substantive threshold."
    },
    {
      "rule_id": "causal_integrity_requires_resolved_causal_constraints",
      "field": "causal_reasoning_integrity",
      "applied_value": "weak",
      "reason": "Unresolved causal constraints remain."
    }
  ],
  "conflicts": [
    {
      "field": "repair_quality",
      "deterministic_value": "cap:max_partial@gcr<0.8",
      "arbiter_value": "substantive",
      "resolution": "capped_to_partial"
    },
    {
      "field": "causal_reasoning_integrity",
      "deterministic_value": "cap:weak",
      "arbiter_value": "strong",
      "resolution": "capped_to_weak"
    }
  ],
  "audit_trace": [
    {
      "trace_type": "reconciler",
      "message": "Reconciled deterministic and arbiter outputs."
    }
  ]
}
